{
  "a2a_extension_version": "0.2.0",
  "submission_id": "sub-mode-b-review-0001",
  "submitted_at": "2026-05-07T11:05:00Z",
  "submission_mode": "agent_submitted",
  "agent_id": "partner-integration-bot-7",
  "agent_assertion": "redacted: assertion present, intermediate delegation evidence incomplete",
  "chain_depth": 1,
  "principal_id": "principal-org-17",
  "l0_codes": [
    "FRC-L0-MODEL-UNDISCLOSED"
  ],
  "document_codes": [],
  "compound_verdict": "REVIEW",
  "compound_confidence": 0.69,
  "frc_payload": {
    "frc_schema_version": "1.0.0",
    "sdb26_version": "SDB-26-v0.2",
    "verdict": "GENUINE",
    "verdict_confidence": 0.88,
    "sdb26_class": "GENUINE",
    "attack_level": "L1",
    "primary_codes": [],
    "supporting_codes": [],
    "required_action": "approve",
    "forensic_note": "Document-level forensic checks do not indicate manipulation.",
    "model_trace": {
      "detector_version": "doclens-detector-0.9.3",
      "pipeline_id": "prod-eu-kyc-v2"
    },
    "decision_id": "dec-mode-b-review-0001",
    "evaluated_at": "2026-05-07T11:05:20Z"
  },
  "analyst_note": "Mode B review path: document appears genuine, but attestation is only partial under policy due to missing capability disclosure.",
  "corpus_version": "SDB-26-A2A-v0.2"
}
